R_ID,R_NAME,R_DESC,R_OWNER,R_STATUS
R_ID313,R_NAME242,"Hospital procedures must endow the attending clinician access to the door key135, yet prevent other persons’ access.2",Caleb,Completed
R_ID314,R_NAME589,When auditory alarms are inactive the control panel shall display an inactive auditory alarm symbol from Table D.201 Graphical symbols for ALARM SYSTEMS of standard IEC 60601-1-8.2,Caleb,Completed
R_ID315,R_NAME771,"If delivered basal flow rate exceeds the prescribed basal rate setting by more than its allowed tolerance over a period of more than 5 minutes, or immediately if the pump goes into free flow, the pump shall issue an basal over-infusion alarm (EC3.2.7).2",Caleb,Completed
R_ID316,R_NAME726,Component failure must not harm patient (beyond stopping function).2,Alex,Open
R_ID317,R_NAME43,"If the drug loaded into the drug reservoir is not present in the drug library or the library does not pass authentication and integrity checks, that the drug is unknown2",Priya,Completed
R_ID318,R_NAME973,"When an occlusion alarm occurs, the pump shall be stopped immediately without completing the current pump stroke2",Caleb,Deffered
R_ID319,R_NAME871,An air-in-line alarm116 shall be triggered by the pump if detectable air bubbles are infused into the patient.2,Jay,Completed
R_ID320,R_NAME706,The PCA pump shall have a stop button2,Caleb,Completed
R_ID321,R_NAME66,The Control Panel shall audibly indicate the specific problem causing the alarm condition as described in Section 5.4.32,Caleb,Open
R_ID322,R_NAME235,sound of audible alarm2,Caleb,Open
R_ID323,R_NAME121,The drug reservoir shall measure its contents.2,Alex,Completed
R_ID324,R_NAME265,The mechanical pump shall not allow reverse flow from the patient into the pump.2,Alex,Completed
R_ID325,R_NAME73,The PCA pump case must be at least difficult to breech as its tamper-resistant door. Breaking the case shall not be easier to access the drug reservoir than breeching the door.2,Priya,Completed
R_ID326,R_NAME982,"Because the drugs used for analgesia are often narcotic, requiring Drug Enforcement Agency (DEA) tracking if used in the United States, the drug reservoir and means to change prescriptions2",Caleb,Completed
R_ID327,R_NAME908,"If a drug library’s soft limit is violated by the proposed settings, but not a hard limit, a warning is shown to the clinician by the user interface and a distinctive, irritating sound made and recorded in the Event Log.2",Caleb,Completed
R_ID328,R_NAME588,Prescriptions that violate the soft limits of the drug in the drug library shall issue a visible and audible warning requiring a soft limit confirmation by the clinician.2,Caleb,Completed
R_ID329,R_NAME364,The PCA pump shall detect upstream occlusion.2,Caleb,Completed
R_ID330,R_NAME744,"If delivered clinician-requested bolus flow rate is less than the calculated square bolus rate by more than its allowed tolerance over a period of more than 5 minutes, or immediately if the flow stops2",Alex,Deffered
R_ID331,R_NAME223,"display of visual information, and2",Alex,Completed
R_ID332,R_NAME860,The control panel shall allow authorized clinician bolus request 60 and choice of duration.2,Priya,Completed
R_ID333,R_NAME458,"If alarms are inactivated or paused through the ICE supervisor user interface, they shall be reactivated upon loss of connection to ICE2",Caleb,Completed
R_ID334,R_NAME447,"If delivered clinician-requested bolus flow rate exceeds the calculated square bolus rate by more than its allowed tolerance over a period of more than 5 minutes, or immediately if the pump goes into free flow2",Caleb,Completed
R_ID335,R_NAME164,An authorized clinician must personally confirm the prescription97 is authentic and meant for the patient to be infused. The routine procedures by which clinicians load the drug reservoir must ensure that the prescription filled by an authorized2,Jay,Open
R_ID336,R_NAME544,The PCA pump shall maintain an electronic event log to record each action taken by the pump and each event sensed of its environment.2,Caleb,Completed
R_ID337,R_NAME612,"A patient-requested bolus shall take precedence over a clinician-requested bolus. The clinicianrequested bolus shall be suspended while the patient-requested bolus dose is administered, and resumed afterward.2",Alex,Completed
R_ID338,R_NAME17,"During normal use and/or single fault condition of the equipment, continuous reverse delivery115 shall not be possible (from IEC 601-2-24)2",Alex,Completed
R_ID339,R_NAME417,"The mechanical pump shall pump drug at prescribed flow rates for basal, bolus, and KVO infusion when commanded.2",Caleb,Completed
R_ID340,R_NAME258,"If the estimated battery life remaining is less than ?lba = 3 minutes, the pump shall issue a low-battery warning.2",Alex,Open
R_ID341,R_NAME527,The scanner shall read and authenticate information from the drug’s package label2,Caleb,Open
R_ID342,R_NAME405,"–removed, must scan Rx from label of drug container2",Priya,Completed
R_ID343,R_NAME128,The drug reservoir holds liquid pain-killer supplied by the hospital pharmacy and loaded into the PCA pump by the clinician.2,Alex,Deffered
R_ID344,R_NAME648,The Control Panel shall provide means to inactivate audible alarms temporarily for a predefined period of time.2,Caleb,Completed
R_ID345,R_NAME233,"Upon the clinician’s pressing of the stop button, prescribed infusion shall halt.2",Caleb,Completed
R_ID346,R_NAME593,A downstream occlusion alarm119 shall be triggered if the pump senses a downstream (patient side)2,Alex,Completed
R_ID347,R_NAME584,"Hardware faults detected, but not masked, shall raise a fault alarm, stop pump, record it in the Fault Log, and display the reason for fault on the user interface.2",Alex,Completed
R_ID348,R_NAME462,At least one visual alarm signal shall be provided that identifies the specific alarm condition and its priority. This signal shall be perceived correctly (be legible) at a distance of 1 m from the equipment2,Alex,Completed
R_ID349,R_NAME285,"If a drug library’s hard limit is violated by the proposed settings, the limit violated is indicated2",Priya,Completed
R_ID350,R_NAME611,"The basal flow rate, F(basal) is prescribed by a physican and entred into the PCA pump by scanning the presription from the drug container label as it is loaded into the reservoir.2",Caleb,Completed
R_ID351,R_NAME888,"The PCA pump shall perform periodic self-tests to assure system integrity during long periods of use. Failure of a self-test shall raise a self-test alarm, stop pump, record it in the Fault Log, and display the reason for failure on the user interface.2",Priya,Completed
R_ID352,R_NAME418,"A clinician-requested bolus shall be delivered at the rate, Fccb, of V T BI divided by the duration chosen by the clinician, ?ccb, in addition to the prescribed basal flow rate, Fbasal, but no more than the maximum flow rate for the pump, Fmax.2",Alex,Completed
R_ID353,R_NAME599,Patient-requested bolus delivery shall be immediately halted when alarms sound.2,Caleb,Completed
R_ID354,R_NAME236,The auditory volume of audible alarms signals shall conform to Section 201.3.3.2 Volume of auditory ALARM SIGNALS and INFORMATION SIGNALS of standard IEC 60601-1-8.2,Priya,Completed
R_ID355,R_NAME116,The PCA pump shall issue alarms and warnings that require clinician attention.2,Caleb,Completed
R_ID356,R_NAME546,"A patient-requested bolus shall be delivered at its prescribed rate, Fbolus, in addition to the prescribed basal flow rate, Fbasal, but no more than the maximum flow rate for the pump, Fmax.2",Alex,Completed
R_ID357,R_NAME231,The fault log shall record at least 1000 faults before overwriting oldest fault records first.2,Priya,Deffered
R_ID358,R_NAME918,The scanner shall read and authenticate information from the patient’s wristband2,Caleb,Completed
R_ID359,R_NAME430,Pressing the stop button confirms and silences all alarms and terminates any alarm signal inactivation.2,Priya,Completed
R_ID360,R_NAME610,Priority for alarms and warnings is shown in Table 4; warnings are low-priority alarms. The last column show the alarm pump rate to be used while the alarm is in effect. For “special” flow rates for power malfunctions see Section 6.3.2,Priya,Completed
R_ID361,R_NAME901,"If delivered patient-requested bolus flow rate is less than the prescribed bolus rate setting by more than its allowed tolerance over a period of more than 1 minutes, or immediately if the flow stops2",Caleb,Completed
R_ID362,R_NAME925,–removed all Rx entry via scanner2,Caleb,Open
R_ID363,R_NAME933,The PCA pump shall include electronic tamper detection mechanisms and shall record detected tampering attempts in the Fault Log and Event Log as well as issuing an authenticated ICE message.2,Caleb,Open
R_ID364,R_NAME915,The PCA pump shall use a physician’s prescription as device parameters.2,Priya,Completed
R_ID365,R_NAME410,Alarms shall be issued in order of occurrence.2,Alex,Completed
R_ID366,R_NAME730,Clinician-requested bolus delivery shall be immediately halted when alarms sound.2,Caleb,Open
R_ID367,R_NAME57,"Upon the clinician’s pressing of the start button, prescribed infusion shall commence.2",Caleb,Open
R_ID368,R_NAME909,"If the drug volume in the reservoir measures less than Vers =0.5 ml, and an infusion is in progress, an empty-reservoir alarm101 shall be issued stopping the pump.2",Alex,Open
R_ID369,R_NAME2,The PCA pump shall detect air-in-line embolism (bubble).2,Alex,Deffered
R_ID370,R_NAME635,The Control Panel shall provide means to inactivate audible alarms indefinitely2,Caleb,Completed
R_ID371,R_NAME250,"The PCA pump shall detect power supply voltage out-of-range, issue a voltage out-of-range warning, and switch to battery backup when out-of-range.2",Alex,Completed
R_ID372,R_NAME483,"After the clinician presses the start button, but before commencing infusion, the values of V T BI and Fbasal are checked against the drug library entry of the drug to be infused.2",Caleb,Completed
R_ID373,R_NAME190,The Control Panel shall provide means to cancel alarm signal inactivation.2,Caleb,Completed
R_ID374,R_NAME411,A real-time clock must produce timestamps accurate to 10 ms.2,Caleb,Completed
R_ID375,R_NAME746,"The PCA pump shall perform a power-on-self-test (POST) to assure system integrity after being turned on, yet before any infusion begins. Failure of POST shall raise a POST alarm, stop pump2",Priya,Completed
R_ID376,R_NAME419,"The user interface must show that the PCA pump is working on battery backup, and an estimate of the number of minutes of battery-powered infusion remain.2",Caleb,Completed
R_ID377,R_NAME131,Visual alarms shall display alarm symbols from Table D.201 Graphical symbols for ALARM SYSTEMS of standard IEC 60601-1-8.2,Jay,Completed
R_ID378,R_NAME974,"Prior to, or coincident with, loading the drug reservoir must also enter prescription96 on the drug container’s label using the scanner.2",Caleb,Completed
R_ID379,R_NAME848,The estimate of remaining battery energy must be accurate to within Xbtty = 25%.2,Caleb,Deffered
R_ID380,R_NAME155,"The PCA pump shall continue to infuse for 10 minutes during interruption of mains electricity supply using battery backup, either continuously or spread over an hour. (Five minutes to recharge per minute using battery.)2",Alex,Completed
R_ID381,R_NAME919,Prescribed V T BI and rate shall not exceed the hard limits set by the drug library from the hospital pharmacy for the drug loaded in the PCA pump.2,Caleb,Completed
R_ID382,R_NAME862,Each log entry shall have a time stamp81 with its time of occurrence.2,Caleb,Deffered
R_ID383,R_NAME718,"If a visual indicator is necessary for the clinician to identify the equipment or part of the equipment that requires clinician response or awareness, at least one visual alarm signal 46 shall be provided2",Priya,Deffered
R_ID384,R_NAME365,"The minimum clinician-chosen duration for a clinician-requested bolus shall be the prescribed minimum number of minutes between consecutive patient-requested bolus deliveries, ?prb.2",Jay,Completed
R_ID385,R_NAME591,Patient-requested bolus shall not be delivered if infusing prescribed V T BI will exceed hard limits retrieved from the drug library for the volume of drug infused over a period of time.2,Caleb,Completed
R_ID386,R_NAME717,"For each drug that may be infused with a PCA pump, the drug library entry103 for that drug shall have data elements listed in Table 6.2",Caleb,Completed
R_ID387,R_NAME205,"A clinician observing the discomfort of the patient may command the PCA pump to deliver a square bolus of the same volume-to-be-infused, V T BI, as patient-requested bolus over a period of time chosen by the clinician.2",Caleb,Completed
R_ID388,R_NAME371,Alarm’s and warning’s priority shall be determined in accordance with standard IEC 60601-1-8 Medical electrical equipment - Part 1-8: General requirements for safety - Collateral standard.2,Jay,Deffered
R_ID389,R_NAME505,The ICE Interface shall transmit encrypted and authenticated current operating status to the ICE system.2,Caleb,Completed
R_ID390,R_NAME861,The drug loaded into the reservoir must also be found in the PCA pump’s drug in library99. The drug code of the prescription must match the drug code of a drug library entry.2,Alex,Completed
R_ID391,R_NAME218,The ICE interface shall allow an authorized clinician to set the duration of clinician-requested boluses through an ICE supervisor user interface.2,Caleb,Deffered
R_ID392,R_NAME815,A open door alarm shall be triggered when the reservoir door is opened while the pump is not stopped.2,Alex,Completed
R_ID393,R_NAME762,The PCA pump must be electromagnetically compatible according to IEC 60601-1-2 (2001)2,Caleb,Completed
R_ID394,R_NAME457,"Changing prescription during infusion shall require prescription confirmation61, clinician authentication62, patient authentication63, prescription authentication64 (patient-to-drug match) and drug authentication2",Alex,Completed
R_ID395,R_NAME278,The pump shall deliver basal infusion at the prescribed basal rate within a basal infusion flow tolerance of Fbasal tol = 0.5 ml/hr of the prescribed basal rate.2,Caleb,Completed
R_ID396,R_NAME808,"When the stop button is pressed, the current pump stroke shall be completed prior to stopping the pump.2",Caleb,Completed
R_ID397,R_NAME523,The PCA pump shall detect air-in-line embolism (bubble).3,Caleb,Completed
R_ID398,R_NAME836,The Control Panel shall visually indicate the specific problem causing the alarm condition as described in Section 5.4.2.3,Caleb,Completed
R_ID399,R_NAME514,"If alarms are inactivated or paused through the ICE supervisor user interface, they shall be reactivated upon loss of connection to ICE3",Caleb,Completed
R_ID400,R_NAME508,"Patient-requested bolus shall not be delivered more often than a prescribed number of minutes, ?prb.3",Jay,Completed
R_ID401,R_NAME755,Temporarily paused alarms shall reactivate ?ap = 10 minutes after inactivation.3,Priya,Open
R_ID402,R_NAME493,"The PCA pump shall continue to infuse for 10 minutes during interruption of mains electricity supply using battery backup, either continuously or spread over an hour. (Five minutes to recharge per minute using battery.)3",Alex,Open
R_ID403,R_NAME241,"–removed, must scan Rx from label of drug container3",Caleb,Open
R_ID404,R_NAME715,sound of audible alarm3,Caleb,Open
R_ID405,R_NAME665,Prescriptions that violate the soft limits of the drug in the drug library shall issue a visible and audible warning requiring a soft limit confirmation by the clinician.3,Priya,Open
R_ID406,R_NAME338,Component failure must not harm patient (beyond stopping function).3,Alex,Deffered
R_ID407,R_NAME234,"Hospital procedures must endow the attending clinician access to the door key135, yet prevent other persons’ access.3",Caleb,Open
R_ID408,R_NAME521,Prescriptions that violate a hard limit of the drug in the drug library shall be rejected with visible and audible indication when confirmation is attempted by the clinician.3,Caleb,Open
R_ID409,R_NAME286,The PCA pump shall measure drug flow within a tolerance of Fmdf tol = 0.1 ml/hr.3,Alex,Open
R_ID410,R_NAME222,The PCA pump shall resume prescribed infusion upon receiving an authenticated command through its ICE interface.3,Caleb,Open
R_ID411,R_NAME707,The pump shall be able to deliver basal infusion at flows throughout the basal infusion flow range of Fbasal min = 1 to Fbasal max = 10 ml/hr.3,Caleb,Open
R_ID412,R_NAME987,Information in event and Fault Logs shall be retained for at least ?log = 1000 hours after the PCA pump is turned-off and unplugged.3,Caleb,Open
R_ID413,R_NAME669,The event log shall record 30 days of typical events before overwriting oldest event records first.3,Caleb,Open
R_ID414,R_NAME144,"If the same alert-stop-start sequence occurs 3 or more times in ten minutes, infusion will be stopped, and an audible alarm sounded.3",Caleb,Open
R_ID415,R_NAME796,The Control Panel shall audibly indicate the specific problem causing the alarm condition as described in Section 5.4.33,Alex,Open
R_ID416,R_NAME317,The pump shall deliver basal infusion at the prescribed basal rate within a basal infusion flow tolerance of Fbasal tol = 0.5 ml/hr of the prescribed basal rate.3,Alex,Open
R_ID417,R_NAME607,The Control Panel shall provide means to cancel alarm signal inactivation.3,Priya,Open
R_ID418,R_NAME166,An air-in-line alarm116 shall be triggered by the pump if detectable air bubbles are infused into the patient.3,Caleb,Open
R_ID419,R_NAME253,") All filled prescriptions (liquid, narcotic pain-killer dispensed by the hospital pharmacy) must be labeled at least visibly with a. Patient name b. Drug code c. Name of drug d. Concentration3",Priya,Open
R_ID420,R_NAME711,The scanner shall read and authenticate information from the drug’s package label3,Priya,Deffered
R_ID421,R_NAME846,The Control Panel shall provide means to inactivate audible alarms indefinitely3,Caleb,Open
R_ID422,R_NAME327,"If the pump gets overheated to more than Tpoh = 55 C, the pump shall issue an pump overheated alarm (EC3.2.9).3",Jay,Deffered
R_ID423,R_NAME779,Clinician-requested bolus delivery shall be immediately halted when alarms sound.3,Caleb,Completed
R_ID424,R_NAME101,"Hardware faults detected, but not masked, shall raise a fault alarm, stop pump, record it in the Fault Log, and display the reason for fault on the user interface.3",Alex,Open
R_ID425,R_NAME842,The scanner shall read and authenticate information from the patient’s wristband3,Caleb,Open
R_ID426,R_NAME676,The mechanical pump shall not allow reverse flow from the patient into the pump.3,Caleb,Completed
R_ID427,R_NAME4,The ICE interface shall allow an authorized clinician to set the duration of clinician-requested boluses through an ICE supervisor user interface.3,Caleb,Open
R_ID428,R_NAME343,The PCA pump shall detect upstream occlusion.3,Caleb,Open
R_ID429,R_NAME900,"A patient-requested bolus shall be delivered at its prescribed rate, Fbolus, in addition to the prescribed basal flow rate, Fbasal, but no more than the maximum flow rate for the pump, Fmax.3",Alex,Open
R_ID430,R_NAME65,"The PCA pump shall maintain an electronic fault log to record each fault condition, and the associated alarm and/or alert issued.3",Caleb,Open
R_ID431,R_NAME781,"The PCA pump shall have continuous fault-detection and masking. Hardware monitors of thread heartbeat, memory error correction codes are examples.3",Alex,Open
R_ID432,R_NAME703,An authorized clinician must personally confirm the prescription97 is authentic and meant for the patient to be infused. The routine procedures by which clinicians load the drug reservoir must ensure that the prescription filled by an authorized3,Caleb,Open
R_ID433,R_NAME225,"If delivered patient-requested bolus flow rate is less than the prescribed bolus rate setting by more than its allowed tolerance over a period of more than 1 minutes, or immediately if the flow stops3",Priya,Open
R_ID434,R_NAME614,"Changing prescription during infusion shall require prescription confirmation61, clinician authentication62, patient authentication63, prescription authentication64 (patient-to-drug match) and drug authentication3",Caleb,Open
R_ID435,R_NAME38,"A patient-requested bolus shall take precedence over a clinician-requested bolus. The clinicianrequested bolus shall be suspended while the patient-requested bolus dose is administered, and resumed afterward.3",Caleb,Open
R_ID436,R_NAME992,"For each drug that may be infused with a PCA pump, the drug library entry103 for that drug shall have data elements listed in Table 6.3",Priya,Open
R_ID437,R_NAME310,"If the estimated battery life remaining is less than ?lba = 3 minutes, the pump shall issue a low-battery warning.3",Jay,Open
R_ID438,R_NAME44,"If delivered clinician-requested bolus flow rate is less than the calculated square bolus rate by more than its allowed tolerance over a period of more than 5 minutes, or immediately if the flow stops3",Caleb,Open
R_ID439,R_NAME872,The PCA pump shall switch to KVO infusion rate upon receiving an authenticated command through its ICE interface.3,Caleb,Open
R_ID440,R_NAME283,The PCA pump shall detect downstream occlusion.3,Caleb,Open
R_ID441,R_NAME355,"If a drug library’s hard limit is violated by the proposed settings, the limit violated is indicated3",Jay,Open
R_ID442,R_NAME219,Each tone in the alarm melody shall be composed of a minimum of 4 harmonic components in the range 300 Hz to 4000 Hz comprising an inverted 9th jazz chord.3,Alex,Open
R_ID443,R_NAME692,A open door alarm shall be triggered when the reservoir door is opened while the pump is not stopped.3,Caleb,Open
R_ID444,R_NAME180,"Successfully masked faults shall be recorded in the Fault Log, but raise an alarm.3",Priya,Open
R_ID445,R_NAME780,The PCA pump shall issue alarms and warnings that require clinician attention.3,Priya,Open
R_ID446,R_NAME31,An upstream occlusion alarm118 shall be triggered when the pump senses an upstream (drug reservoir side) occlusion exceeding Puo = 1 psi3,Caleb,Open
R_ID447,R_NAME147,"Upon the clinician’s pressing of the stop button, prescribed infusion shall halt.3",Priya,Open
R_ID448,R_NAME353,Prescribed V T BI and rate shall not exceed the hard limits set by the drug library from the hospital pharmacy for the drug loaded in the PCA pump.3,Caleb,Open
R_ID449,R_NAME828,"When an empty-reservoir alarm occurs, the current pump stroke shall be completed prior to stopping the pump.3",Caleb,Open
R_ID450,R_NAME805,The maximum clinician-chosen duration for a clinician-requested bolus shall be ?ccb max = 6 hours.3,Alex,Open
R_ID451,R_NAME255,Alarms shall be issued in order of occurrence.3,Caleb,Open
R_ID452,R_NAME220,"A clinician-requested bolus shall be delivered at the rate, Fccb, of V T BI divided by the duration chosen by the clinician, ?ccb, in addition to the prescribed basal flow rate, Fbasal, but no more than the maximum flow rate for the pump, Fmax.3",Caleb,Completed
R_ID453,R_NAME548,The PCA pump shall maintain an electronic event log to record each action taken by the pump and each event sensed of its environment.3,Caleb,Deffered
R_ID454,R_NAME990,"The mechanical pump shall pump drug at prescribed flow rates for basal, bolus, and KVO infusion when commanded.3",Jay,Open
R_ID455,R_NAME757,The control panel shall allow authorized clinician bolus request 60 and choice of duration.3,Caleb,Open
R_ID456,R_NAME659,"During normal use and/or single fault condition of the equipment, continuous reverse delivery115 shall not be possible (from IEC 601-2-24)3",Priya,Open
R_ID457,R_NAME445,A downstream occlusion alarm119 shall be triggered if the pump senses a downstream (patient side)3,Caleb,Open
R_ID458,R_NAME498,"When the stop button is pressed, the current pump stroke shall be completed prior to stopping the pump.3",Jay,Open
R_ID459,R_NAME579,"If the drug loaded into the drug reservoir is not present in the drug library or the library does not pass authentication and integrity checks, that the drug is unknown3",Caleb,Open
R_ID460,R_NAME712,All alarms not of high priority shall be encrypted and authenticated. High priority alarms may be encrypted and authenticated.3,Priya,Open
R_ID461,R_NAME440,"Because with either working battery or power supply can operate the pump, if the battery failure alarm and either the voltage out-of-range or the power supply failure alarms, then the pump rate will be off.3",Alex,Open
R_ID462,R_NAME312,"If a drug library’s soft limit is violated by the proposed settings, but not a hard limit, a warning is shown to the clinician by the user interface and a distinctive, irritating sound made and recorded in the Event Log.3",Priya,Open
R_ID463,R_NAME339,"The user interface must show that the PCA pump is working on battery backup, and an estimate of the number of minutes of battery-powered infusion remain.3",Alex,Open
R_ID464,R_NAME582,"The minimum clinician-chosen duration for a clinician-requested bolus shall be the prescribed minimum number of minutes between consecutive patient-requested bolus deliveries, ?prb.3",Priya,Open
R_ID465,R_NAME530,Priority for alarms and warnings is shown in Table 4; warnings are low-priority alarms. The last column show the alarm pump rate to be used while the alarm is in effect. For “special” flow rates for power malfunctions see Section 6.3.3,Alex,Deffered
R_ID466,R_NAME23,Patient-requested bolus delivery shall be immediately halted when alarms sound.3,Alex,Open
R_ID467,R_NAME598,The drug reservoir holds liquid pain-killer supplied by the hospital pharmacy and loaded into the PCA pump by the clinician.3,Alex,Open
R_ID468,R_NAME865,The measured drug volume shall be within Vrt = 1 ml of the actual drug volume.3,Priya,Deffered
R_ID469,R_NAME975,The alarm melody of audible alarms signals shall conform to Table AAA.1 of standard IEC 60601-1-8 for drug or fluid delivery. “C d g” shall be used for medium priority alarms; “C d g - C d” shall be used for high priority alarms3,Caleb,Open
