RA_ID,RA_RISK,RA_DESC,RA_LIKELIHOOD,RA_IMPACT,RA_MITIGATED
RA_ID1459,Medium,"If delivered patient-requested bolus flow rate exceeds the prescribed patient-requested bolus rate setting by more than its allowed tolerance over a period of more than 1 minutes, or immediately if the pump goes into free flow12",Low,Low,Y
RA_ID1460,Low,The ICE Interface shall transmit encrypted and authenticated current operating status to the ICE system.12,Medium,Low,Y
RA_ID1461,Low,"A clinician observing the discomfort of the patient may command the PCA pump to deliver a square bolus of the same volume-to-be-infused, V T BI, as patient-requested bolus over a period of time chosen by the clinician.12",Medium,High,Y
RA_ID1462,Medium,An upstream occlusion alarm118 shall be triggered when the pump senses an upstream (drug reservoir side) occlusion exceeding Puo = 1 psi12,Medium,High,Y
RA_ID1463,Low,The scanner shall read and authenticate information from the drug’s package label12,Low,High,Y
RA_ID1464,Medium,Temporarily paused alarms shall reactivate ?ap = 10 minutes after inactivation.12,Low,Catastrophic,Y
RA_ID1465,Low,"The mechanical pump shall halt pumping when commanded, or caused in response to an alarm condition.12",Medium,Low,Y
RA_ID1466,Low,The PCA pump must be electromagnetically compatible according to IEC 60601-1-2 (2001)12,High,Low,N
RA_ID1467,Medium,"If delivered patient-requested bolus flow rate is less than the prescribed bolus rate setting by more than its allowed tolerance over a period of more than 1 minutes, or immediately if the flow stops12",Low,Catastrophic,Y
RA_ID1468,Low,"If delivered basal flow rate is less than the prescribed basal rate setting by more than its allowed tolerance over a period of more than 5 minutes, or immediately if the flow stops, the pump shall issue an basal under-infusion warning (EC3.2.8).12",Low,Low,Y
RA_ID1469,High,"For each drug that may be infused with a PCA pump, the drug library entry103 for that drug shall have data elements listed in Table 6.12",Low,Low,Y
RA_ID1470,Medium,"The PCA pump shall perform a power-on-self-test (POST) to assure system integrity after being turned on, yet before any infusion begins. Failure of POST shall raise a POST alarm, stop pump12",Low,Catastrophic,Y
RA_ID1471,Low,"During normal use and/or single fault condition of the equipment, continuous reverse delivery115 shall not be possible (from IEC 601-2-24)12",Medium,Low,Y
RA_ID1472,Low,A real-time clock must produce timestamps accurate to 10 ms.12,Low,Low,Y
RA_ID1473,Medium,The PCA pump shall detect air-in-line embolism (bubble).12,High,Low,Y
RA_ID1474,Low,The auditory volume of audible alarms signals shall conform to Section 201.3.3.2 Volume of auditory ALARM SIGNALS and INFORMATION SIGNALS of standard IEC 60601-1-8.12,Low,Low,Y
RA_ID1475,Medium,"If a visual indicator is necessary for the clinician to identify the equipment or part of the equipment that requires clinician response or awareness, at least one visual alarm signal 46 shall be provided12",Low,Low,Y
RA_ID1476,Low,The drug reservoir holds liquid pain-killer supplied by the hospital pharmacy and loaded into the PCA pump by the clinician.12,Medium,Low,Y
RA_ID1477,Low,"If the same alert-stop-start sequence occurs 3 or more times in ten minutes, infusion will be stopped, and an audible alarm sounded.12",High,Low,Y
RA_ID1478,High,"The PCA pump shall have continuous fault-detection and masking. Hardware monitors of thread heartbeat, memory error correction codes are examples.12",High,Catastrophic,Y
RA_ID1479,Medium,sound of audible alarm12,Medium,High,Y
RA_ID1480,Low,"Because the drugs used for analgesia are often narcotic, requiring Drug Enforcement Agency (DEA) tracking if used in the United States, the drug reservoir and means to change prescriptions12",Low,Low,Y
RA_ID1481,Medium,All alarms not of high priority shall be encrypted and authenticated. High priority alarms may be encrypted and authenticated.12,Medium,Low,Y
RA_ID1482,Low,The PCA pump shall implement a safety architecture112 that separates normal operation from fault detection and response.12,Low,High,Y
RA_ID1483,Medium,When auditory alarms are inactive the control panel shall display an inactive auditory alarm symbol from Table D.201 Graphical symbols for ALARM SYSTEMS of standard IEC 60601-1-8.12,Low,Low,N
RA_ID1484,Low,"Because with either working battery or power supply can operate the pump, if the battery failure alarm and either the voltage out-of-range or the power supply failure alarms, then the pump rate will be off.12",Low,High,Y
RA_ID1485,Low,The Control Panel shall audibly indicate the specific problem causing the alarm condition as described in Section 5.4.312,Medium,High,Y
RA_ID1486,Low,The Control Panel shall provide means to cancel alarm signal inactivation.12,Medium,Low,Y
RA_ID1487,High,The drug loaded into the reservoir must also be found in the PCA pump’s drug in library99. The drug code of the prescription must match the drug code of a drug library entry.12,Low,Catastrophic,Y
RA_ID1488,Low,Prescriptions that violate a hard limit of the drug in the drug library shall be rejected with visible and audible indication when confirmation is attempted by the clinician.12,Low,Catastrophic,Y
RA_ID1489,High,The control panel must display currently-programmed patient data and physician’s prescription.12,High,Low,Y
RA_ID1490,Medium,The scanner shall read and authenticate information from the clinician’s badge12,Low,Low,Y
RA_ID1491,Medium,"The minimum clinician-chosen duration for a clinician-requested bolus shall be the prescribed minimum number of minutes between consecutive patient-requested bolus deliveries, ?prb.12",Medium,Low,Y
RA_ID1492,Low,"If alarms are inactivated or paused through the ICE supervisor user interface, they shall be reactivated upon loss of connection to ICE12",Low,Low,Y
RA_ID1493,High,Alarm’s and warning’s priority shall be determined in accordance with standard IEC 60601-1-8 Medical electrical equipment - Part 1-8: General requirements for safety - Collateral standard.12,Low,Catastrophic,Y
RA_ID1494,Low,"–requirement removed, Rx read from drug container by scanner12",Low,Low,Y
RA_ID1495,Low,The Control Panel shall provide means to inactivate audible alarms indefinitely12,Low,High,Y
RA_ID1496,Low,"If the pump gets overheated to more than Tpoh = 55 C, the pump shall issue an pump overheated alarm (EC3.2.9).12",Low,Low,Y
RA_ID1497,Medium,A open door alarm shall be triggered when the reservoir door is opened while the pump is not stopped.12,Low,Catastrophic,Y
RA_ID1498,High,"When the stop button is pressed, the current pump stroke shall be completed prior to stopping the pump.12",Low,Low,N
RA_ID1499,Low,Visual alarms shall display alarm symbols from Table D.201 Graphical symbols for ALARM SYSTEMS of standard IEC 60601-1-8.12,Low,Low,Y
RA_ID1500,Low,Patient-requested bolus shall not be delivered if infusing prescribed V T BI will exceed hard limits retrieved from the drug library for the volume of drug infused over a period of time.12,Medium,Low,Y
RA_ID1501,Medium,The PCA pump shall have a start button.12,Low,Low,Y
RA_ID1502,Medium,All materials that contact fluid shall be biocompatible12,Medium,Low,Y
RA_ID1503,Low,"Upon the clinician’s pressing of the start button, prescribed infusion shall commence.12",Low,Low,Y
RA_ID1504,Low,Component failure must not harm patient (beyond stopping function).12,Low,Low,Y
RA_ID1505,Low,The PCA pump shall detect downstream occlusion.12,Low,High,N
RA_ID1506,Medium,Pressing the stop button confirms and silences all alarms and terminates any alarm signal inactivation.12,Low,High,Y
RA_ID1507,Low,"When an occlusion alarm occurs, the pump shall be stopped immediately without completing the current pump stroke12",Low,High,Y
RA_ID1508,Medium,"Hospital procedures must endow the attending clinician access to the door key135, yet prevent other persons’ access.12",High,Low,Y
RA_ID1509,Low,The PCA pump shall detect air-in-line embolism (bubble).13,Low,High,Y
RA_ID1510,Low,The scanner shall read and authenticate information from the drug’s package label13,Low,Catastrophic,Y
RA_ID1511,Low,The maximum clinician-chosen duration for a clinician-requested bolus shall be ?ccb max = 6 hours.13,Low,Catastrophic,Y
RA_ID1512,Low,Hardware faults that prevent operation of the Control Panel shall illuminate a hardware fault indicator (light-emitting diode).13,Low,High,Y
RA_ID1513,High,A real-time clock must produce timestamps accurate to 10 ms.13,Low,Low,Y
RA_ID1514,Medium,The ICE interface shall allow an authorized clinician to set the duration of clinician-requested boluses through an ICE supervisor user interface.13,Low,High,Y
RA_ID1515,Medium,Clinician-commanded bolus shall be halted when continuing to infuse prescribed V T BI will exceed hard limits retrieved from the drug library for the volume of drug infused over a period of time.13,Low,High,Y
RA_ID1516,Medium,The Control Panel shall provide means to cancel alarm signal inactivation.13,Medium,Low,Y
RA_ID1517,Low,The pump shall deliver basal infusion at the prescribed basal rate within a basal infusion flow tolerance of Fbasal tol = 0.5 ml/hr of the prescribed basal rate.13,Medium,Low,Y
RA_ID1518,Medium,"During normal use and/or single fault condition of the equipment, continuous reverse delivery115 shall not be possible (from IEC 601-2-24)13",Medium,Low,Y
RA_ID1519,Medium,When auditory alarms are inactive the control panel shall display an inactive auditory alarm symbol from Table D.201 Graphical symbols for ALARM SYSTEMS of standard IEC 60601-1-8.13,Low,Low,N
RA_ID1520,Low,The PCA pump shall have a stop button13,Low,Low,Y
RA_ID1521,Low,"Because the drugs used for analgesia are often narcotic, requiring Drug Enforcement Agency (DEA) tracking if used in the United States, the drug reservoir and means to change prescriptions13",Medium,Low,Y
RA_ID1522,Low,Each log entry shall have a time stamp81 with its time of occurrence.13,Low,Low,Y
RA_ID1523,Low,The ICE Interface shall transmit encrypted and authenticated current operating status to the ICE system.13,Medium,Low,Y
RA_ID1524,Medium,"The mechanical pump shall halt pumping when commanded, or caused in response to an alarm condition.13",High,Low,Y
RA_ID1525,Low,Temporarily paused alarms shall reactivate ?ap = 10 minutes after inactivation.13,Low,High,Y
RA_ID1526,Medium,The PCA pump shall detect downstream occlusion.13,Medium,Low,Y
RA_ID1527,Low,The PCA pump shall detect upstream occlusion.13,High,Low,Y
RA_ID1528,High,"–requirement removed, Rx read from drug container by scanner13",Low,Catastrophic,Y
RA_ID1529,Low,"If the drug volume in the reservoir measures less than Vers =0.5 ml, and an infusion is in progress, an empty-reservoir alarm101 shall be issued stopping the pump.13",Low,High,Y
RA_ID1530,Low,"Upon patient’s press of the PCA pump’s patient-button, a prescribed bolus volume-to-be-infused, V T BI, of the drug loaded in the pump is delivered to the patient.13",Low,Catastrophic,Y
RA_ID1531,Medium,Visual alarms shall display alarm symbols from Table D.201 Graphical symbols for ALARM SYSTEMS of standard IEC 60601-1-8.13,Medium,Low,Y
RA_ID1532,Medium,"If a visual indicator is necessary for the clinician to identify the equipment or part of the equipment that requires clinician response or awareness, at least one visual alarm signal 46 shall be provided13",Low,High,Y
RA_ID1533,Medium,The pump shall be able to deliver basal infusion at flows throughout the basal infusion flow range of Fbasal min = 1 to Fbasal max = 10 ml/hr.13,Low,Low,Y
RA_ID1534,Low,The mechanical pump shall not allow reverse flow from the patient into the pump.13,Low,High,Y
RA_ID1535,High,The PCA pump must be electromagnetically compatible according to IEC 60601-1-2 (2001)13,Medium,Low,Y
RA_ID1536,High,"If delivered clinician-requested bolus flow rate exceeds the calculated square bolus rate by more than its allowed tolerance over a period of more than 5 minutes, or immediately if the pump goes into free flow13",Low,Catastrophic,Y
RA_ID1537,Low,"A patient-requested bolus shall be delivered at its prescribed rate, Fbolus, in addition to the prescribed basal flow rate, Fbasal, but no more than the maximum flow rate for the pump, Fmax.13",Low,Catastrophic,Y
RA_ID1538,Low,Pressing the stop button confirms and silences all alarms and terminates any alarm signal inactivation.13,Low,Low,Y
RA_ID1539,Medium,"If the drug loaded into the drug reservoir is not present in the drug library or the library does not pass authentication and integrity checks, that the drug is unknown13",Medium,Low,Y
RA_ID1540,Low,"If delivered basal flow rate is less than the prescribed basal rate setting by more than its allowed tolerance over a period of more than 5 minutes, or immediately if the flow stops, the pump shall issue an basal under-infusion warning (EC3.2.8).13",Medium,Low,N
RA_ID1541,Low,"If the drug volume in the reservoir measures less than Vlra = 1 ml, and an infusion is in progress, a low-reservoir warning100 shall be issued.13",Low,Low,Y
RA_ID1542,Low,The PCA pump shall measure drug flow within a tolerance of Fmdf tol = 0.1 ml/hr.13,Medium,Low,Y
RA_ID1543,Low,"The basal flow rate, F(basal) is prescribed by a physican and entred into the PCA pump by scanning the presription from the drug container label as it is loaded into the reservoir.13",Low,Catastrophic,Y
RA_ID1544,Medium,sound of audible alarm13,Low,Low,N
RA_ID1545,Medium,The PCA pump shall have a start button.13,Low,Low,Y
RA_ID1546,Medium,"A clinician observing the discomfort of the patient may command the PCA pump to deliver a square bolus of the same volume-to-be-infused, V T BI, as patient-requested bolus over a period of time chosen by the clinician.13",Medium,Low,Y
RA_ID1547,Medium,"The drug library102 can be thought of as a lookup table that, given a drug name and a location, provides typical and safe limits of different infusion parameters. The drug library shall be determined by an authorized and authenticated hospital pharmacist13",Medium,Low,Y
RA_ID1548,Low,All alarms not of high priority shall be encrypted and authenticated. High priority alarms may be encrypted and authenticated.13,Low,Low,Y
RA_ID1549,Low,"Upon the clinician’s pressing of the start button, prescribed infusion shall commence.13",High,Low,Y
RA_ID1550,Medium,An air-in-line alarm116 shall be triggered by the pump if detectable air bubbles are infused into the patient.13,Medium,High,Y
RA_ID1551,Medium,"The PCA pump shall perform periodic self-tests to assure system integrity during long periods of use. Failure of a self-test shall raise a self-test alarm, stop pump, record it in the Fault Log, and display the reason for failure on the user interface.13",Low,Low,Y
RA_ID1552,Low,Information in event and Fault Logs shall be retained for at least ?log = 1000 hours after the PCA pump is turned-off and unplugged.13,Low,High,Y
RA_ID1553,Low,"If the pump gets overheated to more than Tpoh = 55 C, the pump shall issue an pump overheated alarm (EC3.2.9).13",Low,Low,Y
RA_ID1554,Low,The fault log shall record at least 1000 faults before overwriting oldest fault records first.13,Low,Low,Y
RA_ID1555,Low,"When the stop button is pressed, the current pump stroke shall be completed prior to stopping the pump.13",Low,Low,Y
RA_ID1556,Medium,"Prior to, or coincident with, loading the drug reservoir must also enter prescription96 on the drug container’s label using the scanner.13",Low,Low,N
RA_ID1557,Low,The PCA pump shall switch to KVO infusion rate upon receiving an authenticated command through its ICE interface.13,Medium,Low,Y
RA_ID1558,Low,"A clinician-requested bolus shall be delivered at the rate, Fccb, of V T BI divided by the duration chosen by the clinician, ?ccb, in addition to the prescribed basal flow rate, Fbasal, but no more than the maximum flow rate for the pump, Fmax.13",Low,Catastrophic,Y
RA_ID1559,Low,"The user interface must show that the PCA pump is working on battery backup, and an estimate of the number of minutes of battery-powered infusion remain.13",Low,Low,Y
RA_ID1560,Low,"A patient-requested bolus shall take precedence over a clinician-requested bolus. The clinicianrequested bolus shall be suspended while the patient-requested bolus dose is administered, and resumed afterward.13",Low,Catastrophic,Y
RA_ID1561,Medium,"Hospital procedures must endow the attending clinician access to the door key135, yet prevent other persons’ access.13",High,High,Y
RA_ID1562,Low,"The PCA pump shall have continuous fault-detection and masking. Hardware monitors of thread heartbeat, memory error correction codes are examples.13",Medium,Low,Y
RA_ID1563,Low,The measured drug volume shall be within Vrt = 1 ml of the actual drug volume.13,Low,High,N
RA_ID1564,Low,"Changing prescription during infusion shall require prescription confirmation61, clinician authentication62, patient authentication63, prescription authentication64 (patient-to-drug match) and drug authentication13",High,High,Y
RA_ID1565,Low,The Control Panel shall audibly indicate the specific problem causing the alarm condition as described in Section 5.4.313,Low,High,Y
RA_ID1566,Low,The PCA pump shall include electronic tamper detection mechanisms and shall record detected tampering attempts in the Fault Log and Event Log as well as issuing an authenticated ICE message.13,Low,Low,Y
RA_ID1567,Medium,A open door alarm shall be triggered when the reservoir door is opened while the pump is not stopped.13,Medium,Low,Y
RA_ID1568,Low,Priority for alarms and warnings is shown in Table 4; warnings are low-priority alarms. The last column show the alarm pump rate to be used while the alarm is in effect. For “special” flow rates for power malfunctions see Section 6.3.13,Low,Low,Y
RA_ID1569,Medium,The drug loaded into the reservoir must also be found in the PCA pump’s drug in library99. The drug code of the prescription must match the drug code of a drug library entry.13,Medium,Low,Y
RA_ID1570,Medium,Prescribed V T BI and rate shall not exceed the hard limits set by the drug library from the hospital pharmacy for the drug loaded in the PCA pump.13,Medium,High,Y
RA_ID1571,Medium,Prescriptions that violate a hard limit of the drug in the drug library shall be rejected with visible and audible indication when confirmation is attempted by the clinician.13,Low,High,Y
RA_ID1572,Low,The PCA pump shall issue alarms and warnings that require clinician attention.13,High,Low,Y
RA_ID1573,Low,"Upon the clinician’s pressing of the stop button, prescribed infusion shall halt.13",Medium,Low,Y
RA_ID1574,High,"The PCA pump shall maintain an electronic fault log to record each fault condition, and the associated alarm and/or alert issued.13",Medium,Low,Y
RA_ID1575,Medium,"Hardware faults detected, but not masked, shall raise a fault alarm, stop pump, record it in the Fault Log, and display the reason for fault on the user interface.13",Low,High,Y
RA_ID1576,Medium,The scanner shall read and authenticate information from the clinician’s badge13,High,Low,Y
RA_ID1577,Low,"If delivered clinician-requested bolus flow rate is less than the calculated square bolus rate by more than its allowed tolerance over a period of more than 5 minutes, or immediately if the flow stops13",Low,Low,Y
RA_ID1578,Low,The auditory volume of audible alarms signals shall conform to Section 201.3.3.2 Volume of auditory ALARM SIGNALS and INFORMATION SIGNALS of standard IEC 60601-1-8.13,Medium,Low,Y
RA_ID1579,Low,"Patient-requested bolus shall not be delivered more often than a prescribed number of minutes, ?prb.13",High,Low,Y
RA_ID1580,Low,"The PCA pump shall perform a power-on-self-test (POST) to assure system integrity after being turned on, yet before any infusion begins. Failure of POST shall raise a POST alarm, stop pump13",Low,High,Y
RA_ID1581,Low,A downstream occlusion alarm119 shall be triggered if the pump senses a downstream (patient side)13,High,Low,Y
RA_ID1582,Low,The PCA pump shall implement a safety architecture112 that separates normal operation from fault detection and response.13,Low,Low,Y
RA_ID1583,Low,Clinician-requested bolus delivery shall be immediately halted when alarms sound.13,Low,High,Y
RA_ID1584,Low,"If delivered patient-requested bolus flow rate is less than the prescribed bolus rate setting by more than its allowed tolerance over a period of more than 1 minutes, or immediately if the flow stops13",Low,Low,N
RA_ID1585,Low,The PCA pump shall use a physician’s prescription as device parameters.13,Medium,Low,Y
RA_ID1586,Medium,"Because with either working battery or power supply can operate the pump, if the battery failure alarm and either the voltage out-of-range or the power supply failure alarms, then the pump rate will be off.13",High,Low,Y
RA_ID1587,Low,An authorized clinician must personally confirm the prescription97 is authentic and meant for the patient to be infused. The routine procedures by which clinicians load the drug reservoir must ensure that the prescription filled by an authorized13,Low,Low,Y
RA_ID1588,Low,"When an occlusion alarm occurs, the pump shall be stopped immediately without completing the current pump stroke13",Medium,High,Y
RA_ID1589,Low,Each tone in the alarm melody shall be composed of a minimum of 4 harmonic components in the range 300 Hz to 4000 Hz comprising an inverted 9th jazz chord.13,Medium,Low,Y
RA_ID1590,Low,Patient-requested bolus delivery shall be immediately halted when alarms sound.13,Low,Low,Y
RA_ID1591,Low,–removed all Rx entry via scanner13,Low,High,Y
RA_ID1592,Low,The PCA pump shall maintain an electronic event log to record each action taken by the pump and each event sensed of its environment.13,Low,Catastrophic,Y
RA_ID1593,High,"If delivered patient-requested bolus flow rate exceeds the prescribed patient-requested bolus rate setting by more than its allowed tolerance over a period of more than 1 minutes, or immediately if the pump goes into free flow13",Low,Catastrophic,Y
RA_ID1594,Medium,"The PCA pump shall continue to infuse for 10 minutes during interruption of mains electricity supply using battery backup, either continuously or spread over an hour. (Five minutes to recharge per minute using battery.)13",High,Low,Y
RA_ID1595,Low,"The alarm indicator appearance shall comply with color, flashing frequency, and duty cycle given in Table 5.13",Low,Catastrophic,Y
RA_ID1596,Low,"The minimum clinician-chosen duration for a clinician-requested bolus shall be the prescribed minimum number of minutes between consecutive patient-requested bolus deliveries, ?prb.13",Low,Low,Y
RA_ID1597,Medium,"–removed, must scan Rx from label of drug container13",High,Low,Y
RA_ID1598,Low,"If a drug library’s hard limit is violated by the proposed settings, the limit violated is indicated13",Low,High,Y
RA_ID1599,Medium,All materials that contact fluid shall be biocompatible13,Low,Low,Y
RA_ID1600,Low,Alarm’s and warning’s priority shall be determined in accordance with standard IEC 60601-1-8 Medical electrical equipment - Part 1-8: General requirements for safety - Collateral standard.13,Low,Low,Y
RA_ID1601,Low,Component failure must not harm patient (beyond stopping function).13,Low,Low,Y
RA_ID1602,Low,"display of visual information, and13",Low,High,Y
RA_ID1603,Low,Prescriptions that violate the soft limits of the drug in the drug library shall issue a visible and audible warning requiring a soft limit confirmation by the clinician.13,Medium,Catastrophic,Y
RA_ID1604,Medium,The PCA pump shall resume prescribed infusion upon receiving an authenticated command through its ICE interface.13,Low,Low,Y
RA_ID1605,High,The control panel must display currently-programmed patient data and physician’s prescription.13,High,Low,Y
RA_ID1606,Low,"If the same alert-stop-start sequence occurs 3 or more times in ten minutes, infusion will be stopped, and an audible alarm sounded.13",Low,Low,Y
RA_ID1607,Medium,tactile response (button press).13,Low,Low,Y
RA_ID1608,Medium,"If alarms are inactivated or paused through the ICE supervisor user interface, they shall be reactivated upon loss of connection to ICE13",Low,Low,Y
RA_ID1609,Low,The Control Panel shall visually indicate the specific problem causing the alarm condition as described in Section 5.4.2.13,Low,High,Y
RA_ID1610,Low,The Control Panel shall provide means to inactivate audible alarms indefinitely13,Low,Catastrophic,Y
RA_ID1611,Low,Alarms shall be issued in order of occurrence.13,Low,Low,Y
RA_ID1612,Low,The scanner shall read and authenticate information from the patient’s wristband13,Low,Low,Y
RA_ID1613,Medium,"The mechanical pump shall pump drug at prescribed flow rates for basal, bolus, and KVO infusion when commanded.13",Low,Low,Y
RA_ID1614,Low,Patient-requested bolus shall not be delivered if infusing prescribed V T BI will exceed hard limits retrieved from the drug library for the volume of drug infused over a period of time.13,Low,Low,Y
RA_ID1615,Medium,An upstream occlusion alarm118 shall be triggered when the pump senses an upstream (drug reservoir side) occlusion exceeding Puo = 1 psi13,Medium,Low,Y
RA_ID1616,Low,The PCA pump must not leak current greater than 10 mA13,Low,Low,Y
RA_ID1617,High,The drug reservoir holds liquid pain-killer supplied by the hospital pharmacy and loaded into the PCA pump by the clinician.13,Low,Catastrophic,Y
RA_ID1618,Low,At least one visual alarm signal shall be provided that identifies the specific alarm condition and its priority. This signal shall be perceived correctly (be legible) at a distance of 1 m from the equipment13,High,Low,Y
RA_ID1619,Low,"Alarms shall cause audible alarms signals that meet the requirements of Tables 203 and 204 of standard IEC 60601-1-8 for alarm pulses, bursts, and harmonics.13",Medium,Catastrophic,Y
RA_ID1620,Medium,"Occurrence of unavoidable single-event upsets caused by cosmic-ray-induced high- and thermalenergy neutrons must be either masked, or detected to fail-stop13",Low,Low,Y
