RA_ID,RA_RISK,RA_DESC,RA_LIKELIHOOD,RA_IMPACT,RA_MITIGATED
RA_ID490,High,Prescriptions that violate a hard limit of the drug in the drug library shall be rejected with visible and audible indication when confirmation is attempted by the clinician.4,Low,Low,N
RA_ID491,Medium,The PCA pump shall resume prescribed infusion upon receiving an authenticated command through its ICE interface.4,Low,Low,Y
RA_ID492,Medium,An air-in-line alarm116 shall be triggered by the pump if detectable air bubbles are infused into the patient.4,Medium,High,Y
RA_ID493,Low,"The drug library102 can be thought of as a lookup table that, given a drug name and a location, provides typical and safe limits of different infusion parameters. The drug library shall be determined by an authorized and authenticated hospital pharmacist4",Low,Catastrophic,Y
RA_ID494,Low,The ICE Interface shall transmit encrypted and authenticated current operating status to the ICE system.4,Low,High,Y
RA_ID495,Medium,"Changing prescription during infusion shall require prescription confirmation61, clinician authentication62, patient authentication63, prescription authentication64 (patient-to-drug match) and drug authentication4",Low,Low,Y
RA_ID496,Low,"The PCA pump shall have continuous fault-detection and masking. Hardware monitors of thread heartbeat, memory error correction codes are examples.4",Low,Low,Y
RA_ID497,Low,The mechanical pump shall not allow reverse flow from the patient into the pump.4,High,High,N
RA_ID498,High,The PCA pump case must be at least difficult to breech as its tamper-resistant door. Breaking the case shall not be easier to access the drug reservoir than breeching the door.4,Low,High,Y
RA_ID499,Low,Priority for alarms and warnings is shown in Table 4; warnings are low-priority alarms. The last column show the alarm pump rate to be used while the alarm is in effect. For “special” flow rates for power malfunctions see Section 6.3.4,Medium,High,Y
RA_ID500,Low,Alarm’s and warning’s priority shall be determined in accordance with standard IEC 60601-1-8 Medical electrical equipment - Part 1-8: General requirements for safety - Collateral standard.4,High,Low,Y
RA_ID501,Medium,All alarms not of high priority shall be encrypted and authenticated. High priority alarms may be encrypted and authenticated.4,Low,Low,Y
RA_ID502,Medium,The PCA pump shall detect downstream occlusion.4,Low,Catastrophic,Y
RA_ID503,Low,"The PCA pump shall continue to infuse for 10 minutes during interruption of mains electricity supply using battery backup, either continuously or spread over an hour. (Five minutes to recharge per minute using battery.)4",Low,Low,Y
RA_ID504,Low,The scanner shall read and authenticate information from the clinician’s badge4,Low,Catastrophic,Y
RA_ID505,Medium,The maximum clinician-chosen duration for a clinician-requested bolus shall be ?ccb max = 6 hours.4,Low,High,Y
RA_ID506,Medium,The PCA pump shall maintain an electronic event log to record each action taken by the pump and each event sensed of its environment.4,Low,Catastrophic,Y
RA_ID507,High,The pump shall deliver basal infusion at the prescribed basal rate within a basal infusion flow tolerance of Fbasal tol = 0.5 ml/hr of the prescribed basal rate.4,Medium,Low,Y
RA_ID508,Low,The scanner shall read and authenticate information from the drug’s package label4,Medium,Low,Y
RA_ID509,Low,"The PCA pump shall maintain an electronic fault log to record each fault condition, and the associated alarm and/or alert issued.4",Low,High,Y
RA_ID510,Medium,"If alarms are inactivated or paused through the ICE supervisor user interface, they shall be reactivated upon loss of connection to ICE4",Medium,Low,Y
RA_ID511,Low,"If delivered clinician-requested bolus flow rate exceeds the calculated square bolus rate by more than its allowed tolerance over a period of more than 5 minutes, or immediately if the pump goes into free flow4",Low,High,Y
RA_ID512,Low,"During normal use and/or single fault condition of the equipment, continuous reverse delivery115 shall not be possible (from IEC 601-2-24)4",Medium,High,Y
RA_ID513,Low,"The minimum clinician-chosen duration for a clinician-requested bolus shall be the prescribed minimum number of minutes between consecutive patient-requested bolus deliveries, ?prb.4",Low,Low,Y
RA_ID514,Low,All materials that contact fluid shall be biocompatible4,Low,Low,Y
RA_ID515,Low,–removed all Rx entry via scanner4,Low,Low,Y
RA_ID516,Medium,Visual alarms shall display alarm symbols from Table D.201 Graphical symbols for ALARM SYSTEMS of standard IEC 60601-1-8.4,Medium,Low,Y
RA_ID517,Low,"Occurrence of unavoidable single-event upsets caused by cosmic-ray-induced high- and thermalenergy neutrons must be either masked, or detected to fail-stop4",Low,Catastrophic,Y
RA_ID518,Low,"The user interface must show that the PCA pump is working on battery backup, and an estimate of the number of minutes of battery-powered infusion remain.4",High,Low,Y
RA_ID519,Low,"The alarm indicator appearance shall comply with color, flashing frequency, and duty cycle given in Table 5.4",Low,High,Y
RA_ID520,Low,"If a drug library’s hard limit is violated by the proposed settings, the limit violated is indicated4",Low,High,Y
RA_ID521,High,Prescriptions that violate the soft limits of the drug in the drug library shall issue a visible and audible warning requiring a soft limit confirmation by the clinician.4,Low,Catastrophic,Y
RA_ID522,High,Hardware faults that prevent operation of the Control Panel shall illuminate a hardware fault indicator (light-emitting diode).4,High,Low,Y
RA_ID523,Medium,When auditory alarms are inactive the control panel shall display an inactive auditory alarm symbol from Table D.201 Graphical symbols for ALARM SYSTEMS of standard IEC 60601-1-8.4,Low,Low,Y
RA_ID524,High,"When the stop button is pressed, the current pump stroke shall be completed prior to stopping the pump.4",Medium,High,Y
RA_ID525,Low,Pressing the stop button confirms and silences all alarms and terminates any alarm signal inactivation.4,Low,Low,N
RA_ID526,Low,The PCA pump must not leak current greater than 10 mA4,Medium,Low,Y
RA_ID527,Low,Each log entry shall have a time stamp81 with its time of occurrence.4,Medium,Low,Y
RA_ID528,Medium,The scanner shall read and authenticate information from the patient’s wristband4,Low,Low,Y
RA_ID529,Low,A real-time clock must produce timestamps accurate to 10 ms.4,Medium,Low,N
RA_ID530,Low,"The mechanical pump shall halt pumping when commanded, or caused in response to an alarm condition.4",Low,High,Y
RA_ID531,High,Each tone in the alarm melody shall be composed of a minimum of 4 harmonic components in the range 300 Hz to 4000 Hz comprising an inverted 9th jazz chord.4,Low,Low,Y
RA_ID532,Medium,The drug reservoir holds liquid pain-killer supplied by the hospital pharmacy and loaded into the PCA pump by the clinician.4,Medium,Catastrophic,Y
RA_ID533,Medium,"Patient-requested bolus shall not be delivered more often than a prescribed number of minutes, ?prb.4",Low,High,Y
RA_ID534,Low,The auditory volume of audible alarms signals shall conform to Section 201.3.3.2 Volume of auditory ALARM SIGNALS and INFORMATION SIGNALS of standard IEC 60601-1-8.4,Low,Low,Y
RA_ID535,Medium,An upstream occlusion alarm118 shall be triggered when the pump senses an upstream (drug reservoir side) occlusion exceeding Puo = 1 psi4,High,Catastrophic,Y
RA_ID536,Low,The PCA pump shall use a physician’s prescription as device parameters.4,Low,Low,Y
RA_ID537,Low,The PCA pump shall measure drug flow within a tolerance of Fmdf tol = 0.1 ml/hr.4,Low,Low,Y
RA_ID538,Low,"The PCA pump shall perform periodic self-tests to assure system integrity during long periods of use. Failure of a self-test shall raise a self-test alarm, stop pump, record it in the Fault Log, and display the reason for failure on the user interface.4",Medium,Low,Y
RA_ID539,Medium,The fault log shall record at least 1000 faults before overwriting oldest fault records first.4,Low,Low,Y
RA_ID540,Low,"If the same alert-stop-start sequence occurs 3 or more times in ten minutes, infusion will be stopped, and an audible alarm sounded.4",Low,Low,Y
RA_ID541,Low,"If the estimated battery life remaining is less than ?lba = 3 minutes, the pump shall issue a low-battery warning.4",High,Catastrophic,Y
RA_ID542,Medium,An authorized clinician must personally confirm the prescription97 is authentic and meant for the patient to be infused. The routine procedures by which clinicians load the drug reservoir must ensure that the prescription filled by an authorized4,Low,Low,Y
RA_ID543,Low,"Upon the clinician’s pressing of the stop button, prescribed infusion shall halt.4",Low,High,Y
RA_ID544,Medium,The PCA pump shall issue alarms and warnings that require clinician attention.4,Low,High,N
RA_ID545,Medium,"For each drug that may be infused with a PCA pump, the drug library entry103 for that drug shall have data elements listed in Table 6.4",Low,High,Y
RA_ID546,Low,"If the drug volume in the reservoir measures less than Vlra = 1 ml, and an infusion is in progress, a low-reservoir warning100 shall be issued.4",Low,High,Y
RA_ID547,Medium,Alarms shall be issued in order of occurrence.4,Medium,High,Y
RA_ID548,Low,"If delivered clinician-requested bolus flow rate is less than the calculated square bolus rate by more than its allowed tolerance over a period of more than 5 minutes, or immediately if the flow stops4",Medium,Low,Y
RA_ID549,Low,The control panel must display currently-programmed patient data and physician’s prescription.4,Low,Low,Y
RA_ID550,High,Information in event and Fault Logs shall be retained for at least ?log = 1000 hours after the PCA pump is turned-off and unplugged.4,Low,Low,Y
RA_ID551,Low,The pump shall be able to deliver basal infusion at flows throughout the basal infusion flow range of Fbasal min = 1 to Fbasal max = 10 ml/hr.4,Low,Low,Y
RA_ID552,Medium,"Because with either working battery or power supply can operate the pump, if the battery failure alarm and either the voltage out-of-range or the power supply failure alarms, then the pump rate will be off.4",Low,Catastrophic,Y
RA_ID553,Low,"When an occlusion alarm occurs, the pump shall be stopped immediately without completing the current pump stroke4",Low,High,Y
RA_ID554,Low,The drug loaded into the reservoir must also be found in the PCA pump’s drug in library99. The drug code of the prescription must match the drug code of a drug library entry.4,Medium,Catastrophic,Y
RA_ID555,Medium,The Control Panel shall provide means to cancel alarm signal inactivation.4,Medium,Low,Y
RA_ID556,Low,Component failure must not harm patient (beyond stopping function).4,Low,Low,Y
RA_ID557,Low,The PCA pump shall detect air-in-line embolism (bubble).4,Low,Low,Y
RA_ID558,High,tactile response (button press).4,Low,Low,Y
RA_ID559,Low,Clinician-commanded bolus shall be halted when continuing to infuse prescribed V T BI will exceed hard limits retrieved from the drug library for the volume of drug infused over a period of time.4,Low,High,Y
RA_ID560,Medium,"If the pump gets overheated to more than Tpoh = 55 C, the pump shall issue an pump overheated alarm (EC3.2.9).4",Low,High,N
RA_ID561,Low,"A patient-requested bolus shall be delivered at its prescribed rate, Fbolus, in addition to the prescribed basal flow rate, Fbasal, but no more than the maximum flow rate for the pump, Fmax.4",Medium,Low,Y
RA_ID562,High,A open door alarm shall be triggered when the reservoir door is opened while the pump is not stopped.4,Low,Low,Y
RA_ID563,Medium,"Upon the clinician’s pressing of the start button, prescribed infusion shall commence.4",Low,High,Y
RA_ID564,Medium,Prescribed V T BI and rate shall not exceed the hard limits set by the drug library from the hospital pharmacy for the drug loaded in the PCA pump.4,Low,Low,Y
RA_ID565,Low,Clinician-requested bolus delivery shall be immediately halted when alarms sound.4,Low,Low,Y
RA_ID566,Low,"display of visual information, and4",High,High,Y
RA_ID567,Medium,The PCA pump shall implement a safety architecture112 that separates normal operation from fault detection and response.4,Medium,Catastrophic,Y
RA_ID568,Medium,"If the drug loaded into the drug reservoir is not present in the drug library or the library does not pass authentication and integrity checks, that the drug is unknown4",Low,High,Y
RA_ID569,Medium,The ICE interface shall allow an authorized clinician to set the duration of clinician-requested boluses through an ICE supervisor user interface.4,High,Low,Y
RA_ID570,Low,At least one visual alarm signal shall be provided that identifies the specific alarm condition and its priority. This signal shall be perceived correctly (be legible) at a distance of 1 m from the equipment4,Medium,Catastrophic,Y
RA_ID571,Low,"If the drug volume in the reservoir measures less than Vers =0.5 ml, and an infusion is in progress, an empty-reservoir alarm101 shall be issued stopping the pump.4",Low,Low,Y
RA_ID572,Low,The PCA pump shall detect upstream occlusion.4,Medium,High,Y
RA_ID573,Medium,"A clinician-requested bolus shall be delivered at the rate, Fccb, of V T BI divided by the duration chosen by the clinician, ?ccb, in addition to the prescribed basal flow rate, Fbasal, but no more than the maximum flow rate for the pump, Fmax.4",Low,Low,Y
RA_ID574,Low,"A patient-requested bolus shall take precedence over a clinician-requested bolus. The clinicianrequested bolus shall be suspended while the patient-requested bolus dose is administered, and resumed afterward.4",Medium,Low,N
RA_ID575,Low,"Hardware faults detected, but not masked, shall raise a fault alarm, stop pump, record it in the Fault Log, and display the reason for fault on the user interface.4",Low,High,Y
RA_ID576,Low,"Prior to, or coincident with, loading the drug reservoir must also enter prescription96 on the drug container’s label using the scanner.4",Low,Low,N
RA_ID577,Low,"Because the drugs used for analgesia are often narcotic, requiring Drug Enforcement Agency (DEA) tracking if used in the United States, the drug reservoir and means to change prescriptions4",Medium,Low,Y
RA_ID578,Medium,The PCA pump shall have a stop button4,Low,Low,Y
RA_ID579,Medium,"The PCA pump shall perform a power-on-self-test (POST) to assure system integrity after being turned on, yet before any infusion begins. Failure of POST shall raise a POST alarm, stop pump4",Low,Low,Y
RA_ID580,Low,"Hospital procedures must endow the attending clinician access to the door key135, yet prevent other persons’ access.4",Low,Low,Y
RA_ID581,Medium,"Prior to, or coincident with, loading the drug reservoir must also enter prescription96 on the drug container’s label using the scanner.5",Low,High,Y
RA_ID582,Low,"If delivered patient-requested bolus flow rate is less than the prescribed bolus rate setting by more than its allowed tolerance over a period of more than 1 minutes, or immediately if the flow stops5",Medium,High,Y
RA_ID583,High,"If delivered clinician-requested bolus flow rate is less than the calculated square bolus rate by more than its allowed tolerance over a period of more than 5 minutes, or immediately if the flow stops5",Low,Low,Y
RA_ID584,Medium,"The PCA pump shall have continuous fault-detection and masking. Hardware monitors of thread heartbeat, memory error correction codes are examples.5",Medium,Low,Y
RA_ID585,Low,The ICE interface shall allow an authorized clinician to set the duration of clinician-requested boluses through an ICE supervisor user interface.5,Low,Low,Y
RA_ID586,Medium,"If the drug loaded into the drug reservoir is not present in the drug library or the library does not pass authentication and integrity checks, that the drug is unknown5",Low,Catastrophic,Y
RA_ID587,Low,The PCA pump shall have a stop button5,Low,High,Y
RA_ID588,Low,"–requirement removed, Rx read from drug container by scanner5",Low,Low,Y
RA_ID589,Low,An authorized clinician must personally confirm the prescription97 is authentic and meant for the patient to be infused. The routine procedures by which clinicians load the drug reservoir must ensure that the prescription filled by an authorized5,Medium,Low,Y
RA_ID590,Medium,"If the same alert-stop-start sequence occurs 3 or more times in ten minutes, infusion will be stopped, and an audible alarm sounded.5",Low,Low,Y
RA_ID591,Low,The scanner shall read and authenticate information from the clinician’s badge5,High,Low,Y
RA_ID592,Medium,The PCA pump case must be at least difficult to breech as its tamper-resistant door. Breaking the case shall not be easier to access the drug reservoir than breeching the door.5,Low,Low,Y
RA_ID593,Low,Each log entry shall have a time stamp81 with its time of occurrence.5,Low,Low,Y
RA_ID594,Medium,sound of audible alarm5,Low,High,Y
RA_ID595,High,"Alarms shall cause audible alarms signals that meet the requirements of Tables 203 and 204 of standard IEC 60601-1-8 for alarm pulses, bursts, and harmonics.5",Low,Low,Y
RA_ID596,Low,The PCA pump shall issue alarms and warnings that require clinician attention.5,Medium,Low,Y
RA_ID597,Low,"A patient-requested bolus shall be delivered at its prescribed rate, Fbolus, in addition to the prescribed basal flow rate, Fbasal, but no more than the maximum flow rate for the pump, Fmax.5",Medium,High,Y
RA_ID598,Low,"If the estimated battery life remaining is less than ?lba = 3 minutes, the pump shall issue a low-battery warning.5",Medium,Low,Y
RA_ID599,Low,"The drug library102 can be thought of as a lookup table that, given a drug name and a location, provides typical and safe limits of different infusion parameters. The drug library shall be determined by an authorized and authenticated hospital pharmacist5",Low,Low,Y
RA_ID600,Low,The control panel must display currently-programmed patient data and physician’s prescription.5,Medium,Low,Y
RA_ID601,Low,"A clinician observing the discomfort of the patient may command the PCA pump to deliver a square bolus of the same volume-to-be-infused, V T BI, as patient-requested bolus over a period of time chosen by the clinician.5",Low,Low,Y
RA_ID602,Low,"If a visual indicator is necessary for the clinician to identify the equipment or part of the equipment that requires clinician response or awareness, at least one visual alarm signal 46 shall be provided5",Low,Low,Y
RA_ID603,Medium,"The mechanical pump shall halt pumping when commanded, or caused in response to an alarm condition.5",Low,High,Y
RA_ID604,Low,Pressing the stop button confirms and silences all alarms and terminates any alarm signal inactivation.5,Low,Low,N
RA_ID605,Low,"Upon the clinician’s pressing of the start button, prescribed infusion shall commence.5",Medium,Low,Y
RA_ID606,High,"If the drug volume in the reservoir measures less than Vers =0.5 ml, and an infusion is in progress, an empty-reservoir alarm101 shall be issued stopping the pump.5",High,Low,Y
RA_ID607,Low,Visual alarms shall display alarm symbols from Table D.201 Graphical symbols for ALARM SYSTEMS of standard IEC 60601-1-8.5,Medium,High,Y
RA_ID608,Low,"Because with either working battery or power supply can operate the pump, if the battery failure alarm and either the voltage out-of-range or the power supply failure alarms, then the pump rate will be off.5",Low,High,Y
RA_ID609,Low,Patient-requested bolus delivery shall be immediately halted when alarms sound.5,Medium,Low,N
RA_ID610,Low,The PCA pump shall detect downstream occlusion.5,Medium,High,Y
RA_ID611,Low,The PCA pump shall resume prescribed infusion upon receiving an authenticated command through its ICE interface.5,Medium,High,Y
RA_ID612,Low,"When the stop button is pressed, the current pump stroke shall be completed prior to stopping the pump.5",Low,Low,N
RA_ID613,Low,"Because the drugs used for analgesia are often narcotic, requiring Drug Enforcement Agency (DEA) tracking if used in the United States, the drug reservoir and means to change prescriptions5",Low,Low,Y
RA_ID614,Low,A open door alarm shall be triggered when the reservoir door is opened while the pump is not stopped.5,Low,Low,Y
RA_ID615,High,A downstream occlusion alarm119 shall be triggered if the pump senses a downstream (patient side)5,Low,Low,Y
RA_ID616,Medium,The PCA pump shall maintain an electronic event log to record each action taken by the pump and each event sensed of its environment.5,Low,High,Y
RA_ID617,Low,A real-time clock must produce timestamps accurate to 10 ms.5,Low,High,Y
RA_ID618,Low,"The PCA pump shall continue to infuse for 10 minutes during interruption of mains electricity supply using battery backup, either continuously or spread over an hour. (Five minutes to recharge per minute using battery.)5",Low,Catastrophic,Y
RA_ID619,Low,"Occurrence of unavoidable single-event upsets caused by cosmic-ray-induced high- and thermalenergy neutrons must be either masked, or detected to fail-stop5",Low,Catastrophic,Y
RA_ID620,Medium,The pump shall deliver basal infusion at the prescribed basal rate within a basal infusion flow tolerance of Fbasal tol = 0.5 ml/hr of the prescribed basal rate.5,Low,Low,Y
RA_ID621,High,Hardware faults that prevent operation of the Control Panel shall illuminate a hardware fault indicator (light-emitting diode).5,Low,Low,N
RA_ID622,Medium,The PCA pump shall detect upstream occlusion.5,Low,Low,Y
RA_ID623,Low,Each tone in the alarm melody shall be composed of a minimum of 4 harmonic components in the range 300 Hz to 4000 Hz comprising an inverted 9th jazz chord.5,Medium,High,Y
RA_ID624,High,The Control Panel shall provide means to inactivate audible alarms indefinitely5,Low,Low,Y
RA_ID625,Low,The Control Panel shall audibly indicate the specific problem causing the alarm condition as described in Section 5.4.35,Low,Low,Y
RA_ID626,Medium,tactile response (button press).5,Medium,Low,Y
RA_ID627,Low,All alarms not of high priority shall be encrypted and authenticated. High priority alarms may be encrypted and authenticated.5,Low,Catastrophic,Y
RA_ID628,High,The event log shall record 30 days of typical events before overwriting oldest event records first.5,Medium,Catastrophic,Y
RA_ID629,Low,"If alarms are inactivated or paused through the ICE supervisor user interface, they shall be reactivated upon loss of connection to ICE5",Low,Low,Y
RA_ID630,Low,The scanner shall read and authenticate information from the patient’s wristband5,Low,Low,Y
RA_ID631,High,The PCA pump shall have a start button.5,Medium,Low,Y
RA_ID632,Medium,Temporarily paused alarms shall reactivate ?ap = 10 minutes after inactivation.5,Low,Low,Y
RA_ID633,Low,The PCA pump shall measure drug flow within a tolerance of Fmdf tol = 0.1 ml/hr.5,Medium,Low,Y
RA_ID634,Low,The measured drug volume shall be within Vrt = 1 ml of the actual drug volume.5,Low,Catastrophic,Y
RA_ID635,Medium,The pump shall be able to deliver basal infusion at flows throughout the basal infusion flow range of Fbasal min = 1 to Fbasal max = 10 ml/hr.5,Low,Low,Y
RA_ID636,Low,The PCA pump shall use a physician’s prescription as device parameters.5,Low,Low,Y
RA_ID637,Low,"If a drug library’s hard limit is violated by the proposed settings, the limit violated is indicated5",Medium,Low,Y
RA_ID638,Low,"For each drug that may be infused with a PCA pump, the drug library entry103 for that drug shall have data elements listed in Table 6.5",Low,Catastrophic,Y
RA_ID639,High,"The user interface must show that the PCA pump is working on battery backup, and an estimate of the number of minutes of battery-powered infusion remain.5",Low,Low,Y
RA_ID640,Low,The mechanical pump shall not allow reverse flow from the patient into the pump.5,High,Low,Y
RA_ID641,Low,The PCA pump must be electromagnetically compatible according to IEC 60601-1-2 (2001)5,Low,Low,Y
RA_ID642,Low,Prescribed V T BI and rate shall not exceed the hard limits set by the drug library from the hospital pharmacy for the drug loaded in the PCA pump.5,Medium,Low,Y
RA_ID643,Low,Clinician-commanded bolus shall be halted when continuing to infuse prescribed V T BI will exceed hard limits retrieved from the drug library for the volume of drug infused over a period of time.5,Low,Low,Y
RA_ID644,Low,"If delivered clinician-requested bolus flow rate exceeds the calculated square bolus rate by more than its allowed tolerance over a period of more than 5 minutes, or immediately if the pump goes into free flow5",Medium,Low,Y
RA_ID645,Low,"If delivered basal flow rate is less than the prescribed basal rate setting by more than its allowed tolerance over a period of more than 5 minutes, or immediately if the flow stops, the pump shall issue an basal under-infusion warning (EC3.2.8).5",Medium,High,Y
RA_ID646,Low,"The minimum clinician-chosen duration for a clinician-requested bolus shall be the prescribed minimum number of minutes between consecutive patient-requested bolus deliveries, ?prb.5",Medium,Catastrophic,Y
RA_ID647,Low,The drug loaded into the reservoir must also be found in the PCA pump’s drug in library99. The drug code of the prescription must match the drug code of a drug library entry.5,Medium,Low,Y
RA_ID648,Low,Patient-requested bolus shall not be delivered if infusing prescribed V T BI will exceed hard limits retrieved from the drug library for the volume of drug infused over a period of time.5,Low,Low,Y
RA_ID649,Medium,"The alarm indicator appearance shall comply with color, flashing frequency, and duty cycle given in Table 5.5",Low,Low,Y
RA_ID650,Low,The maximum clinician-chosen duration for a clinician-requested bolus shall be ?ccb max = 6 hours.5,Medium,High,Y
RA_ID651,Medium,Alarm’s and warning’s priority shall be determined in accordance with standard IEC 60601-1-8 Medical electrical equipment - Part 1-8: General requirements for safety - Collateral standard.5,Low,High,Y
RA_ID652,High,"Patient-requested bolus shall not be delivered more often than a prescribed number of minutes, ?prb.5",Medium,Low,Y
